,GOterm,Mname,Ensmbls,Symbols
1,regulation of store-operated calcium entry,maroon,"['ENSMUSG00000000001', 'ENSMUSG00000001150', 'ENSMUSG00000002602', 'ENSMUSG00000002844', 'ENSMUSG00000005686', 'ENSMUSG00000010609', 'ENSMUSG00000012483', 'ENSMUSG00000018572', 'ENSMUSG00000019975', 'ENSMUSG00000020775', 'ENSMUSG00000021032', 'ENSMUSG00000022285', 'ENSMUSG00000022884', 'ENSMUSG00000024293', 'ENSMUSG00000024309', 'ENSMUSG00000024982', 'ENSMUSG00000025348', 'ENSMUSG00000025785', 'ENSMUSG00000026034', 'ENSMUSG00000026279', 'ENSMUSG00000026696', 'ENSMUSG00000026831', 'ENSMUSG00000027630', 'ENSMUSG00000028093', 'ENSMUSG00000029911', 'ENSMUSG00000031095', 'ENSMUSG00000031198', 'ENSMUSG00000031556', 'ENSMUSG00000031596', 'ENSMUSG00000031639', 'ENSMUSG00000032360', 'ENSMUSG00000032423', 'ENSMUSG00000032724', 'ENSMUSG00000032727', 'ENSMUSG00000034024', 'ENSMUSG00000034211', 'ENSMUSG00000034659', 'ENSMUSG00000035293', 'ENSMUSG00000035620', 'ENSMUSG00000036111', 'ENSMUSG00000036199', 'ENSMUSG00000036225', 'ENSMUSG00000036282', 'ENSMUSG00000036432', 'ENSMUSG00000038517', 'ENSMUSG00000039047', 'ENSMUSG00000040025', 'ENSMUSG00000040289', 'ENSMUSG00000044071', 'ENSMUSG00000046550', 'ENSMUSG00000047045', 'ENSMUSG00000048481', 'ENSMUSG00000049625', 'ENSMUSG00000049796', 'ENSMUSG00000051497', 'ENSMUSG00000053317', 'ENSMUSG00000054277', 'ENSMUSG00000054855', 'ENSMUSG00000056216', 'ENSMUSG00000057113', 'ENSMUSG00000059355', 'ENSMUSG00000063856', 'ENSMUSG00000066189', 'ENSMUSG00000067787', 'ENSMUSG00000070822', 'ENSMUSG00000071073', 'ENSMUSG00000071379', 'ENSMUSG00000078974', 'ENSMUSG00000079435', 'ENSMUSG00000083022', 'ENSMUSG00000090223', 'ENSMUSG00000097303', 'ENSMUSG00000097383']","['Gnai3: guanine nucleotide binding protein (G protein), alpha inhibiting 3', 'Mcm3ap: minichromosome maintenance complex component 3 associated protein', 'Axl: AXL receptor tyrosine kinase', 'Adprh: ADP-ribosylarginine hydrolase', 'Ampd3: adenosine monophosphate deaminase 3', 'Psen2: presenilin 2', 'Rpa3: replication protein A3', 'Phf23: PHD finger protein 23', 'Ikbip: IKBKB interacting protein', 'Mrpl38: mitochondrial ribosomal protein L38', 'Ngb: neuroglobin', 'Ywhaz: tyrosine 3-monooxygenase/tryptophan 5-monooxygenase activation protein, zeta polypeptide', 'Eif4a2: eukaryotic translation initiation factor 4A2', 'Esco1: establishment of sister chromatid cohesion N-acetyltransferase 1', 'Pfdn6: prefoldin subunit 6', 'Zdhhc6: zinc finger, DHHC domain containing 6', 'Itga7: integrin alpha 7', 'Exosc7: exosome component 7', 'Clk1: CDC-like kinase 1', 'Thap4: THAP domain containing 4', 'Vamp4: vesicle-associated membrane protein 4', '1700007K13Rik: RIKEN cDNA 1700007K13 gene', 'Tbl1xr1: transducin (beta)-like 1X-linked receptor 1', 'Acp6: acid phosphatase 6, lysophosphatidic', 'Ssbp1: single-stranded DNA binding protein 1', 'Cul4b: cullin 4B', 'Fundc2: FUN14 domain containing 2', 'Tm2d2: TM2 domain containing 2', 'Slc7a2: solute carrier family 7 (cationic amino acid transporter, y+ system), member 2', 'Tlr3: toll-like receptor 3', 'Hcrtr2: hypocretin (orexin) receptor 2', 'Syncrip: synaptotagmin binding, cytoplasmic RNA interacting protein', 'Abtb2: ankyrin repeat and BTB (POZ) domain containing 2', 'Mier3: MIER family member 3', 'Cct2: chaperonin containing Tcp1, subunit 2 (beta)', 'Mrps17: mitochondrial ribosomal protein S17', 'Tmem109: transmembrane protein 109', 'G2e3: G2/M-phase specific E3 ubiquitin ligase', 'Ric8b: RIC8 guanine nucleotide exchange factor B', 'Lmo1: LIM domain only 1', 'Ndufa13: NADH:ubiquinone oxidoreductase subunit A13', 'Kctd1: potassium channel tetramerisation domain containing 1', 'Naa30: N(alpha)-acetyltransferase 30, NatC catalytic subunit', 'Siah2: siah E3 ubiquitin protein ligase 2', 'Tbkbp1: TBK1 binding protein 1', 'Pigk: phosphatidylinositol glycan anchor biosynthesis, class K', 'Ythdf2: YTH N6-methyladenosine RNA binding protein 2', 'Hey1: hairy/enhancer-of-split related with YRPW motif 1', 'Tafa2: TAFA chemokine like family member 2', 'Spin2c: spindlin family, member 2C', 'Tmem164: transmembrane protein 164', 'Mypop: Myb-related transcription factor, partner of profilin', 'Tifab: TRAF-interacting protein with forkhead-associated domain, family member B', 'Crh: corticotropin releasing hormone', 'Kcnj16: potassium inwardly-rectifying channel, subfamily J, member 16', 'Sec61b: Sec61 beta subunit', 'Arfgap3: ADP-ribosylation factor GTPase activating protein 3', 'Rnd1: Rho family GTPase 1', 'Cebpg: CCAAT/enhancer binding protein (C/EBP), gamma', 'Npm1: nucleophosmin 1', 'Wdr83os: WD repeat domain 83 opposite strand', 'Gpx1: glutathione peroxidase 1', 'Cacng3: calcium channel, voltage-dependent, gamma subunit 3', 'Blcap: bladder cancer associated protein', 'Zscan18: zinc finger and SCAN domain containing 18', 'Lrrc73: leucine rich repeat containing 73', 'Hpcal1: hippocalcin-like 1', 'Sec61g: SEC61, gamma subunit', 'Rpl36a: ribosomal protein L36A', 'Rps15a-ps6: ribosomal protein S15A, pseudogene 6', 'Pcp4: Purkinje cell protein 4', '3110083C13Rik: RIKEN cDNA 3110083C13 gene', '1500026H17Rik: RIKEN cDNA 1500026H17 gene']"
2,antigen processing and presentation of peptide antigen,skyblue,"['ENSMUSG00000000056', 'ENSMUSG00000001313', 'ENSMUSG00000001901', 'ENSMUSG00000002550', 'ENSMUSG00000003131', 'ENSMUSG00000009470', 'ENSMUSG00000009905', 'ENSMUSG00000013593', 'ENSMUSG00000014402', 'ENSMUSG00000014426', 'ENSMUSG00000015127', 'ENSMUSG00000015342', 'ENSMUSG00000015837', 'ENSMUSG00000015846', 'ENSMUSG00000017288', 'ENSMUSG00000017740', 'ENSMUSG00000018659', 'ENSMUSG00000018736', 'ENSMUSG00000019715', 'ENSMUSG00000019732', 'ENSMUSG00000019960', 'ENSMUSG00000019979', 'ENSMUSG00000020515', 'ENSMUSG00000021071', 'ENSMUSG00000021115', 'ENSMUSG00000021130', 'ENSMUSG00000021178', 'ENSMUSG00000021326', 'ENSMUSG00000021340', 'ENSMUSG00000021391', 'ENSMUSG00000021852', 'ENSMUSG00000022022', 'ENSMUSG00000022031', 'ENSMUSG00000022442', 'ENSMUSG00000022561', 'ENSMUSG00000022702', 'ENSMUSG00000022791', 'ENSMUSG00000022833', 'ENSMUSG00000023019', 'ENSMUSG00000024158', 'ENSMUSG00000024160', 'ENSMUSG00000024515', 'ENSMUSG00000024535', 'ENSMUSG00000024780', 'ENSMUSG00000024862', 'ENSMUSG00000025484', 'ENSMUSG00000025487', 'ENSMUSG00000025509', 'ENSMUSG00000025764', 'ENSMUSG00000026317', 'ENSMUSG00000026575', 'ENSMUSG00000026857', 'ENSMUSG00000027004', 'ENSMUSG00000027282', 'ENSMUSG00000027472', 'ENSMUSG00000027584', 'ENSMUSG00000028233', 'ENSMUSG00000028300', 'ENSMUSG00000028670', 'ENSMUSG00000028688', 'ENSMUSG00000028884', 'ENSMUSG00000029276', 'ENSMUSG00000029364', 'ENSMUSG00000029624', 'ENSMUSG00000029787', 'ENSMUSG00000029910', 'ENSMUSG00000030079', 'ENSMUSG00000030168', 'ENSMUSG00000030298', 'ENSMUSG00000030327', 'ENSMUSG00000030428', 'ENSMUSG00000030494', 'ENSMUSG00000030718', 'ENSMUSG00000030785', 'ENSMUSG00000030884', 'ENSMUSG00000031166', 'ENSMUSG00000031171', 'ENSMUSG00000031365', 'ENSMUSG00000031910', 'ENSMUSG00000031922', 'ENSMUSG00000031976', 'ENSMUSG00000032101', 'ENSMUSG00000032604', 'ENSMUSG00000033161', 'ENSMUSG00000033364', 'ENSMUSG00000033943', 'ENSMUSG00000034111', 'ENSMUSG00000034194', 'ENSMUSG00000034341', 'ENSMUSG00000034994', 'ENSMUSG00000035164', 'ENSMUSG00000035297', 'ENSMUSG00000035390', 'ENSMUSG00000036850', 'ENSMUSG00000037257', 'ENSMUSG00000037259', 'ENSMUSG00000037349', 'ENSMUSG00000037373', 'ENSMUSG00000037509', 'ENSMUSG00000038065', 'ENSMUSG00000038141', 'ENSMUSG00000039033', 'ENSMUSG00000040097', 'ENSMUSG00000040177', 'ENSMUSG00000041278', 'ENSMUSG00000041763', 'ENSMUSG00000042078', 'ENSMUSG00000042650', 'ENSMUSG00000043398', 'ENSMUSG00000044285', 'ENSMUSG00000044352', 'ENSMUSG00000044628', 'ENSMUSG00000045573', 'ENSMUSG00000046711', 'ENSMUSG00000047617', 'ENSMUSG00000048142', 'ENSMUSG00000048485', 'ENSMUSG00000048696', 'ENSMUSG00000048826', 'ENSMUSG00000049532', 'ENSMUSG00000049892', 'ENSMUSG00000051067', 'ENSMUSG00000051790', 'ENSMUSG00000051853', 'ENSMUSG00000052040', 'ENSMUSG00000052459', 'ENSMUSG00000053390', 'ENSMUSG00000053411', 'ENSMUSG00000054252', 'ENSMUSG00000054733', 'ENSMUSG00000055334', 'ENSMUSG00000055932', 'ENSMUSG00000057060', 'ENSMUSG00000058351', 'ENSMUSG00000059689', 'ENSMUSG00000059995', 'ENSMUSG00000061981', 'ENSMUSG00000065954', 'ENSMUSG00000066979', 'ENSMUSG00000068205', 'ENSMUSG00000069911', 'ENSMUSG00000071645', 'ENSMUSG00000073016', 'ENSMUSG00000074282', 'ENSMUSG00000074923', 'ENSMUSG00000075054', 'ENSMUSG00000075706', 'ENSMUSG00000076052', 'ENSMUSG00000082588', 'ENSMUSG00000085873', 'ENSMUSG00000091515', 'ENSMUSG00000098061', 'ENSMUSG00000098415', 'ENSMUSG00000099632', 'ENSMUSG00000103793']","['Narf: nuclear prelamin A recognition factor', 'Rnd2: Rho family GTPase 2', 'Kcnh6: potassium voltage-gated channel, subfamily H (eag-related), member 6', 'Uck1: uridine-cytidine kinase 1', 'Pafah1b2: platelet-activating factor acetylhydrolase, isoform 1b, subunit 2', 'Tnpo1: transportin 1', 'Kdsr: 3-ketodihydrosphingosine reductase', 'Ndufs2: NADH:ubiquinone oxidoreductase core subunit S2', 'Tsg101: tumor susceptibility gene 101', 'Map3k4: mitogen-activated protein kinase kinase kinase 4', 'Unkl: unkempt family like zinc finger', 'Xk: X-linked Kx blood group', 'Sqstm1: sequestosome 1', 'Rxra: retinoid X receptor alpha', 'Vps53: VPS53 GARP complex subunit', 'Slc12a5: solute carrier family 12, member 5', ""Pnpo: pyridoxine 5'-phosphate oxidase"", 'Ndel1: nudE neurodevelopment protein 1 like 1', 'Gle1: GLE1 RNA export mediator (yeast)', 'Calr3: calreticulin 3', 'Dusp6: dual specificity phosphatase 6', 'Apaf1: apoptotic peptidase activating factor 1', 'Cnot8: CCR4-NOT transcription complex, subunit 8', 'Trim9: tripartite motif-containing 9', 'Vrk1: vaccinia related kinase 1', 'Galnt16: polypeptide N-acetylgalactosaminyltransferase 16', 'Psmc1: protease (prosome, macropain) 26S subunit, ATPase 1', 'Trim27: tripartite motif-containing 27', 'Gpld1: glycosylphosphatidylinositol specific phospholipase D1', 'Cenpp: centromere protein P', 'Slc35f4: solute carrier family 35, member F4', 'Mtrf1: mitochondrial translational release factor 1', 'Elp3: elongator acetyltransferase complex subunit 3', 'Ttll1: tubulin tyrosine ligase-like 1', 'Gpaa1: GPI anchor attachment protein 1', 'Hira: histone cell cycle regulator', 'Tnk2: tyrosine kinase, non-receptor, 2', 'Ccdc14: coiled-coil domain containing 14', 'Gpd1: glycerol-3-phosphate dehydrogenase 1 (soluble)', 'Hagh: hydroxyacyl glutathione hydrolase', 'Spsb3: splA/ryanodine receptor domain and SOCS box containing 3', 'Smad4: SMAD family member 4', 'Snx24: sorting nexing 24', 'Cdc37l1: cell division cycle 37-like 1', 'Klc2: kinesin light chain 2', 'Bet1l: Bet1 golgi vesicular membrane trafficking protein like', 'Psmd13: proteasome (prosome, macropain) 26S subunit, non-ATPase, 13', 'Pnpla2: patatin-like phospholipase domain containing 2', 'Jade1: jade family PHD finger 1', 'Cln8: CLN8 transmembrane ER and ERGIC protein', 'Nme7: NME/NM23 family member 7', 'Ntmt1: N-terminal Xaa-Pro-Lys N-methyltransferase 1', 'Frzb: frizzled-related protein', 'Mtch2: mitochondrial carrier 2', 'Pdrg1: p53 and DNA damage regulated 1', 'Oprl1: opioid receptor-like 1', 'Tgs1: trimethylguanosine synthase 1', 'C9orf72: C9orf72, member of C9orf72-SMCR8 complex', 'Lypla2: lysophospholipase 2', 'Toe1: target of EGR1, member 1 (nuclear)', 'Rpa2: replication protein A2', 'Glmn: glomulin, FKBP associated protein', 'Wsb2: WD repeat and SOCS box-containing 2', 'Ptcd1: pentatricopeptide repeat domain 1', 'Avl9: AVL9 cell migration associated', 'Mad2l1: MAD2 mitotic arrest deficient-like 1', 'Ruvbl1: RuvB-like protein 1', 'Adipor2: adiponectin receptor 2', 'Sec13: SEC13 homolog, nuclear pore and COPII coat complex component', 'Necap1: NECAP endocytosis associated 1', 'Ttyh1: tweety family member 1', 'Rhpn2: rhophilin, Rho GTPase binding protein 2', 'Ppme1: protein phosphatase methylesterase 1', 'Cox6a2: cytochrome c oxidase subunit 6A2', 'Uqcrc2: ubiquinol cytochrome c reductase core protein 2', 'Wdr13: WD repeat domain 13', 'Ftsj1: FtsJ RNA methyltransferase homolog 1 (E. coli)', 'Zfp275: zinc finger protein 275', 'Has3: hyaluronan synthase 3', 'Cep57: centrosomal protein 57', 'Urb2: URB2 ribosome biogenesis 2 homolog (S. cerevisiae)', 'Ddx25: DEAD box helicase 25', 'Qars: glutaminyl-tRNA synthetase', 'Atp1a1: ATPase, Na+/K+ transporting, alpha 1 polypeptide', 'Usp37: ubiquitin specific peptidase 37', 'Mga: MAX gene associated', 'Tmed8: transmembrane p24 trafficking protein 8', 'R3hcc1: R3H domain and coiled-coil containing 1', 'Wbp2: WW domain binding protein 2', 'Eef2: eukaryotic translation elongation factor 2', 'Zc3h12c: zinc finger CCCH type containing 12C', 'Cops4: COP9 signalosome subunit 4', 'Brsk1: BR serine/threonine kinase 1', 'Mrpl41: mitochondrial ribosomal protein L41', 'Aagab: alpha- and gamma-adaptin binding protein', 'Dzank1: double zinc ribbon and ankyrin repeat domains 1', 'Nudt22: nudix (nucleoside diphosphate linked moiety X)-type motif 22', 'Ctbp1: C-terminal binding protein 1', 'Arhgef4: Rho guanine nucleotide exchange factor (GEF) 4', 'Mturn: maturin, neural progenitor differentiation regulator homolog (Xenopus)', 'Tmem181a: transmembrane protein 181A', 'Tasp1: taspase, threonine aspartase 1', 'Flywch1: FLYWCH-type zinc finger 1', '2310057M21Rik: RIKEN cDNA 2310057M21 gene', 'Ttc1: tetratricopeptide repeat domain 1', 'Tpp2: tripeptidyl peptidase II', 'Svop: SV2 related protein', 'Alkbh5: alkB homolog 5, RNA demethylase', 'Gpr135: G protein-coupled receptor 135', 'Ubb-ps: ubiquitin B, pseudogene', 'Sowaha: sosondowah ankyrin repeat domain family member A', 'Rnf208: ring finger protein 208', 'Penk: preproenkephalin', 'Hmga1: high mobility group AT-hook 1', 'Paxx: non-homologous end joining factor', 'Nat8l: N-acetyltransferase 8-like', 'Zbtb8b: zinc finger and BTB domain containing 8b', 'Mex3d: mex3 RNA binding family member D', 'Dact2: dishevelled-binding antagonist of beta-catenin 2', 'Sall2: spalt like transcription factor 2', 'Rasd1: RAS, dexamethasone-induced 1', 'Lingo3: leucine rich repeat and Ig domain containing 3', 'Nlgn2: neuroligin 2', 'Arf3: ADP-ribosylation factor 3', 'Klf13: Kruppel-like factor 13', 'Atp6v1a: ATPase, H+ transporting, lysosomal V1 subunit A', 'Zfp952: zinc finger protein 952', 'Cbx7: chromobox 7', 'Fgfr3: fibroblast growth factor receptor 3', 'Msra: methionine sulfoxide reductase A', 'Snupn: snurportin 1', 'Fto: fat mass and obesity associated', 'Slc35f3: solute carrier family 35, member F3', 'Smim4: small integral membrane protein 4', 'Zfp637: zinc finger protein 637', 'Atxn7l3: ataxin 7-like 3', 'Flot2: flotillin 2', 'Tacc1: transforming, acidic coiled-coil containing protein 1', 'Bub3: BUB3 mitotic checkpoint protein', 'Macrod2: mono-ADP ribosylhydrolase 2', 'Insyn2b: inhibitory synaptic factor family member 2B', 'Tut1: terminal uridylyl transferase 1, U6 snRNA-specific', 'Uprt: uracil phosphoribosyltransferase', 'Zfp94: zinc finger protein 94', 'Pak6: p21 (RAC1) activated kinase 6', 'Yae1d1: Yae1 domain containing 1', 'Gpx4: glutathione peroxidase 4', 'Mir541: microRNA 541', 'Gm15443: predicted gene 15443', 'Ttc39aos1: Ttc39a opposite strand RNA 1', 'Zfp422-ps: zinc finger protein 422, pseudogene', 'ENSMUSG00000098061', 'Mir6928: microRNA 6928', '2900093K20Rik: RIKEN cDNA 2900093K20 gene', 'Pcdhga6: protocadherin gamma subfamily A, 6']"
